smartctl 7.3 2022-02-28 r5338 [x86_64-linux-6.1.51-mod-std] (local build)
Copyright (C) 2002-22, Bruce Allen, Christian Franke, www.smartmontools.org

=== START OF INFORMATION SECTION ===
Model Number:                       SAMSUNG MZQL2960HCJR-00A07
Serial Number:                      <REDACTED>
Firmware Version:                   GDC5902Q
PCI Vendor/Subsystem ID:            0x144d
IEEE OUI Identifier:                0x002538
Total NVM Capacity:                 960,197,124,096 [960 GB]
Unallocated NVM Capacity:           0
Controller ID:                      6
NVMe Version:                       1.4
Number of Namespaces:               32
Namespace 1 Size/Capacity:          960,197,124,096 [960 GB]
Namespace 1 Utilization:            539,336,921,088 [539 GB]
Namespace 1 Formatted LBA Size:     512
Local Time is:                      Tue Jun 24 09:09:13 2025 UTC
Firmware Updates (0x17):            3 Slots, Slot 1 R/O, no Reset required
Optional Admin Commands (0x005f):   Security Format Frmw_DL NS_Mngmt Self_Test MI_Snd/Rec
Optional NVM Commands (0x005f):     Comp Wr_Unc DS_Mngmt Wr_Zero Sav/Sel_Feat Timestmp
Log Page Attributes (0x0e):         Cmd_Eff_Lg Ext_Get_Lg Telmtry_Lg
Maximum Data Transfer Size:         512 Pages
Warning  Comp. Temp. Threshold:     80 Celsius
Critical Comp. Temp. Threshold:     83 Celsius
Namespace 1 Features (0x1a):        NA_Fields No_ID_Reuse NP_Fields

Supported Power States
St Op     Max   Active     Idle   RL RT WL WT  Ent_Lat  Ex_Lat
 0 +    25.00W   14.00W       -    0  0  0  0       70      70
 1 +     8.00W    8.00W       -    1  1  1  1       70      70

Supported LBA Sizes (NSID 0x1)
Id Fmt  Data  Metadt  Rel_Perf
 0 +     512       0         0
 1 -    4096       0         0

=== START OF SMART DATA SECTION ===
SMART overall-health self-assessment test result: PASSED

SMART/Health Information (NVMe Log 0x02)
Critical Warning:                   0x00
Temperature:                        48 Celsius
Available Spare:                    100%
Available Spare Threshold:          10%
Percentage Used:                    0%
Data Units Read:                    3,898,026 [1.99 TB]
Data Units Written:                 3,724,977 [1.90 TB]
Host Read Commands:                 64,534,779
Host Write Commands:                64,814,313
Controller Busy Time:               57
Power Cycles:                       13
Power On Hours:                     24
Unsafe Shutdowns:                   11
Media and Data Integrity Errors:    0
Error Information Log Entries:      0
Warning  Comp. Temperature Time:    0
Critical Comp. Temperature Time:    0
Temperature Sensor 1:               48 Celsius
Temperature Sensor 2:               59 Celsius

Error Information (NVMe Log 0x01, 16 of 64 entries)
No Errors Logged

